{
  "schema_version": "1.0.0-draft.1",
  "run_id": "urn:foi-process:mining-run:sha256:594785efc42ba83da17caaf3566a36d70985b1a01bab1d2b0d729c48ee37db84",
  "created_at": "2026-07-09T00:05:00Z",
  "source_dataset": "urn:huggingface:dataset:edithatogo/fyi-archive-nz",
  "source_revision": "fixture",
  "software_commit": "uncommitted-workpack-v3",
  "rust_version": "1.88+",
  "rust4pm_version": "0.6.0",
  "foi_process_version": "0.1.0",
  "parameters": {
    "mapping_profile": "urn:foi-process:profile:fyi-minimal"
  },
  "privacy_profile": {
    "sensitivity": "public",
    "access_tier": "public",
    "disposition": "publish",
    "reason_codes": [
      "privacy:fixture_reviewed"
    ],
    "human_reviewed": true
  },
  "inputs": [],
  "outputs": [],
  "environment": {
    "generation": "python-reference-oracle"
  }
}
